{"$schema":"https://json-schema.org/draft/2020-12/schema","properties":{"closingImage":{"type":"string"},"emotionalTurn":{"type":"string"},"intent":{"type":"string"},"openingImage":{"type":"string"},"sequenceId":{"type":"string"},"shots":{"items":{"$ref":"shot.schema.json"},"type":"array"},"title":{"type":"string"}},"required":["sequenceId","title","intent","emotionalTurn","shots"],"title":"Sequence","type":"object"}